{
  "$schema": "https://json-schema.org/draft/2020-12/schema",
  "$id": "urn:dumbmoney:schema:fund-lock:v1",
  "title": "DumbMoney immutable source fund lock",
  "type": "object",
  "additionalProperties": false,
  "required": [
    "schema_version",
    "lock_id",
    "generated_at",
    "operating_mode",
    "deployment_scope",
    "public_distribution",
    "immutable",
    "repositories",
    "contract_assets",
    "internal_use_authorization"
  ],
  "properties": {
    "schema_version": {
      "const": "dumbmoney.fund-lock.v1"
    },
    "lock_id": {
      "type": "string"
    },
    "generated_at": {
      "type": "string",
      "format": "date-time"
    },
    "operating_mode": {
      "const": "PERSONAL_PROP"
    },
    "deployment_scope": {
      "const": "PRIVATE_LOCAL_WINDOWS"
    },
    "public_distribution": {
      "const": false
    },
    "immutable": {
      "const": true
    },
    "repositories": {
      "type": "array",
      "items": {
        "type": "object",
        "additionalProperties": false,
        "required": [
          "name",
          "url",
          "commit",
          "dependency_lock_sha256",
          "package_sha256",
          "contract_schema_version"
        ],
        "properties": {
          "name": {
            "type": "string"
          },
          "url": {
            "type": "string",
            "pattern": "^private-local://[a-z0-9][a-z0-9._-]{0,63}$"
          },
          "commit": {
            "type": "string"
          },
          "dependency_lock_sha256": {
            "type": "string"
          },
          "package_sha256": {
            "type": "string"
          },
          "contract_schema_version": {
            "type": "string"
          }
        }
      }
    },
    "contract_assets": {
      "type": "array",
      "items": {
        "type": "object",
        "additionalProperties": false,
        "required": [
          "name",
          "repository",
          "path",
          "sha256"
        ],
        "properties": {
          "name": {
            "type": "string"
          },
          "repository": {
            "type": "string"
          },
          "path": {
            "type": "string"
          },
          "sha256": {
            "type": "string"
          }
        }
      }
    },
    "internal_use_authorization": {
      "type": "object",
      "additionalProperties": false,
      "required": [
        "status",
        "components",
        "artifact_path",
        "artifact_sha256"
      ],
      "properties": {
        "status": {
          "enum": [
            "UNSIGNED_REQUIRED",
            "SIGNED"
          ]
        },
        "components": {
          "const": [
            "blunder",
            "dummy",
            "dopey",
            "doofus",
            "waterboy",
            "nimrod",
            "dimwit"
          ]
        },
        "artifact_path": {
          "type": "string"
        },
        "artifact_sha256": {
          "type": "string"
        }
      }
    }
  }
}
