{
  "schema_version": "dumbmoney.fund-lock.v1",
  "lock_id": "dumbmoney-v1-template-unresolved",
  "generated_at": "2026-07-26T00:00:00Z",
  "operating_mode": "PERSONAL_PROP",
  "deployment_scope": "PRIVATE_LOCAL_WINDOWS",
  "public_distribution": false,
  "immutable": true,
  "repositories": [
    {
      "name": "blunder",
      "url": "private-local://blunder",
      "commit": "TO_BE_RESOLVED_FROM_CLEAN_WORKTREE",
      "dependency_lock_sha256": "TO_BE_RESOLVED",
      "package_sha256": "TO_BE_RESOLVED",
      "contract_schema_version": "dumbmoney.contracts.v1"
    },
    {
      "name": "dummy",
      "url": "private-local://dummy",
      "commit": "TO_BE_RESOLVED_FROM_CLEAN_WORKTREE",
      "dependency_lock_sha256": "TO_BE_RESOLVED",
      "package_sha256": "TO_BE_RESOLVED",
      "contract_schema_version": "dumbmoney.contracts.v1"
    },
    {
      "name": "dopey",
      "url": "private-local://dopey",
      "commit": "TO_BE_RESOLVED_FROM_CLEAN_WORKTREE",
      "dependency_lock_sha256": "TO_BE_RESOLVED",
      "package_sha256": "TO_BE_RESOLVED",
      "contract_schema_version": "dumbmoney.contracts.v1"
    },
    {
      "name": "doofus",
      "url": "private-local://doofus",
      "commit": "TO_BE_RESOLVED_FROM_CLEAN_WORKTREE",
      "dependency_lock_sha256": "TO_BE_RESOLVED",
      "package_sha256": "TO_BE_RESOLVED",
      "contract_schema_version": "dumbmoney.contracts.v1"
    },
    {
      "name": "waterboy",
      "url": "private-local://waterboy",
      "commit": "TO_BE_RESOLVED_FROM_CLEAN_WORKTREE",
      "dependency_lock_sha256": "TO_BE_RESOLVED",
      "package_sha256": "TO_BE_RESOLVED",
      "contract_schema_version": "dumbmoney.contracts.v1"
    },
    {
      "name": "nimrod",
      "url": "private-local://nimrod",
      "commit": "TO_BE_RESOLVED_FROM_CLEAN_WORKTREE",
      "dependency_lock_sha256": "TO_BE_RESOLVED",
      "package_sha256": "TO_BE_RESOLVED",
      "contract_schema_version": "dumbmoney.contracts.v1"
    },
    {
      "name": "dimwit",
      "url": "private-local://dimwit",
      "commit": "TO_BE_RESOLVED_FROM_CLEAN_WORKTREE",
      "dependency_lock_sha256": "TO_BE_RESOLVED",
      "package_sha256": "TO_BE_RESOLVED",
      "contract_schema_version": "dumbmoney.contracts.v1"
    }
  ],
  "contract_assets": [
    {
      "name": "signed-envelope-schema",
      "repository": "blunder",
      "path": "configs/dumbmoney/schemas/signed-envelope.v1.schema.json",
      "sha256": "4b57af4dc17e107629ef9048ea3b5ed64df5da4611f30d990ce71d09d75cec52"
    },
    {
      "name": "core-runner-config-schema",
      "repository": "blunder",
      "path": "configs/dumbmoney/schemas/core-runner-config.v1.schema.json",
      "sha256": "f293bff3defab79f258ab9ca6d938cab1e93a6961f498f1f0da4790cee0e4eab"
    },
    {
      "name": "model-gateway-runner-config-schema",
      "repository": "blunder",
      "path": "configs/dumbmoney/schemas/model-gateway-runner-config.v1.schema.json",
      "sha256": "2301e1d13cc8dfada70c424a9c464351ee7c0de5d1616056d78507a10c3e1bda"
    },
    {
      "name": "research-mesh-runner-config-schema",
      "repository": "blunder",
      "path": "configs/dumbmoney/schemas/research-mesh-runner-config.v1.schema.json",
      "sha256": "4a2af13f0b58c623e0eefd06071996de9698b85b9f42a628e9d47dc178a9790e"
    },
    {
      "name": "dopey-robinhood-runner-config-schema",
      "repository": "dopey",
      "path": "configs/dumbmoney/schemas/dopey-robinhood-runner.v1.schema.json",
      "sha256": "673fe3ceb7dc17a2740c6b13287e1b3b540a980821749a93e7868397fbdca026"
    },
    {
      "name": "dummy-kalshi-runner-config-schema",
      "repository": "dummy",
      "path": "configs/dumbmoney/schemas/dummy-kalshi-runner.v1.schema.json",
      "sha256": "7cfb68ddc811390dd027e188e7809bb5b7ed4d17b03defff3ca83f9788b63cb7"
    },
    {
      "name": "capital-envelope-schema",
      "repository": "blunder",
      "path": "configs/dumbmoney/schemas/capital-envelope.v1.schema.json",
      "sha256": "ef43b9b5a82e4d86c4d56e82cd58a6ad281e0cd831798379dbf47a88046bed34"
    },
    {
      "name": "capital-request-schema",
      "repository": "blunder",
      "path": "configs/dumbmoney/schemas/capital-request.v1.schema.json",
      "sha256": "0455d9f456c3b508dfd2c0b1e14e224719feeb64fe4992d68d19f0b8acea6eb8"
    },
    {
      "name": "venue-risk-snapshot-schema",
      "repository": "blunder",
      "path": "configs/dumbmoney/schemas/venue-risk-snapshot.v1.schema.json",
      "sha256": "e3e80a50f8c799bef43ef2b0293b0eaf3c8e0b11d2850767ac19c813d857030c"
    },
    {
      "name": "cell-command-page-schema",
      "repository": "blunder",
      "path": "configs/dumbmoney/schemas/cell-command-page.v1.schema.json",
      "sha256": "3a8efdaf8747432f0951c4800c5f42eaa48d7abb14f89153c211621697daa73d"
    },
    {
      "name": "execution-intent-schema",
      "repository": "blunder",
      "path": "configs/dumbmoney/schemas/execution-intent.v1.schema.json",
      "sha256": "29c39d57219923eaee2488297ab8d869e4214b1d893433f53692c299d7c1ec95"
    },
    {
      "name": "cell-contract-resolution-schema",
      "repository": "blunder",
      "path": "configs/dumbmoney/schemas/cell-contract-resolution.v1.schema.json",
      "sha256": "93977ad547c1ba2b08e24fd9eed3b34889629ef28611688f96b3ee90fccf81c5"
    },
    {
      "name": "cell-journal-head-anchor-schema",
      "repository": "blunder",
      "path": "configs/dumbmoney/schemas/cell-journal-head-anchor.v1.schema.json",
      "sha256": "d4760ea1cfa11371b38373a87e5a844e1dc512b9acb728dea31c19f1b298287b"
    },
    {
      "name": "signed-capital-envelope-conformance-fixture",
      "repository": "blunder",
      "path": "configs/dumbmoney/fixtures/signed-capital-envelope.v1.json",
      "sha256": "b0fe2fa0261b2dc36e4043e8c33b91b1016676e04a25e4b4d5bd66eea0c9079a"
    }
  ],
  "internal_use_authorization": {
    "status": "UNSIGNED_REQUIRED",
    "components": [
      "blunder",
      "dummy",
      "dopey",
      "doofus",
      "waterboy",
      "nimrod",
      "dimwit"
    ],
    "artifact_path": "docs/DUMBMONEY_INTERNAL_USE_AUTHORIZATION_TEMPLATE.md",
    "artifact_sha256": "35ed096ebfa7ee9d6883240dc2bed5f354ba3e1a4e2a652086ff6f75cea9ee01"
  }
}
